<?xml version="1.0" encoding="UTF-8"?>
<xs:schema xmlns:xs="http://www.w3.org/2001/XMLSchema">

  <xs:element name="university">
    <xs:complexType>
      <xs:sequence>
        <xs:element name="department">
          <xs:complexType>
            <xs:sequence>
              
              <xs:element name="deptName" type="xs:string"/>
              <xs:element name="deptHead" type="xs:string"/>
              
              <xs:element name="courses">
                <xs:complexType>
                  <xs:sequence>
                    <xs:element name="course">
                      <xs:complexType>
                        <xs:sequence>
                          <xs:element name="courseName" type="xs:string"/>
                          <xs:element name="instructor" type="xs:string"/>
                          <xs:element name="credits" type="xs:integer"/>
                        </xs:sequence>
                      </xs:complexType>
                    </xs:element>
                  </xs:sequence>
                </xs:complexType>
              </xs:element>

            </xs:sequence>
          </xs:complexType>
        </xs:element>
      </xs:sequence>
    </xs:complexType>
  </xs:element>

</xs:schema>
